{
  "framework": "thompson_motif_classes",
  "title": "Thompson — Motif-Index Top-Level Classes",
  "source": "Stith Thompson, Motif-Index of Folk-Literature (1955-58)",
  "license": "system/idea (the 23-class lettered taxonomy); the full ~46k-motif index text is copyright and NOT reproduced — the fine-grained motif table comes from the CC-BY-SA `trilogy` dataset at fetch time",
  "namespace": "ship",
  "domain": "framework",
  "tier_note": "The micro-tier taxonomy ROOTS: the 23 lettered chapters. Content atoms (individual motifs like D1361.4) hang off these; the leaf table is loaded later from `trilogy`. `code` is Thompson's chapter letter (note the index skips I, O, Y).",
  "count": 23,
  "items": [
    { "id": 1,  "code": "A", "name": "Mythological Motifs",            "description": "Creators, gods, the establishment of the world; cosmogony and the origins of things." },
    { "id": 2,  "code": "B", "name": "Animals",                        "description": "Mythical and magical beasts, helpful and hostile animals, animal kingdoms." },
    { "id": 3,  "code": "C", "name": "Tabu",                           "description": "Prohibitions and the consequences of breaking them." },
    { "id": 4,  "code": "D", "name": "Magic",                          "description": "Transformations, magic objects, spells, and enchantment." },
    { "id": 5,  "code": "E", "name": "The Dead",                       "description": "Resuscitation, ghosts, revenants, and the soul." },
    { "id": 6,  "code": "F", "name": "Marvels",                        "description": "Otherworld journeys, marvelous beings and places, extraordinary occurrences." },
    { "id": 7,  "code": "G", "name": "Ogres",                          "description": "Ogres, giants, cannibals, witches, and other devouring monsters." },
    { "id": 8,  "code": "H", "name": "Tests",                          "description": "Recognition, tests of identity, cleverness, and prowess; quests." },
    { "id": 9,  "code": "J", "name": "The Wise and the Foolish",       "description": "Wisdom, cleverness, and their opposite — folly and absurd actions." },
    { "id": 10, "code": "K", "name": "Deceptions",                     "description": "Deceits, thefts, cheats, disguises, and illusions." },
    { "id": 11, "code": "L", "name": "Reversal of Fortune",            "description": "The lowly raised and the mighty brought low; unpredictable outcomes." },
    { "id": 12, "code": "M", "name": "Ordaining the Future",           "description": "Judgments, bargains, promises, oaths, curses, and prophecies." },
    { "id": 13, "code": "N", "name": "Chance and Fate",                "description": "Wagers, luck, accidents, and the workings of fortune and fate." },
    { "id": 14, "code": "P", "name": "Society",                        "description": "Kings, courts, social classes, customs, trades, and institutions." },
    { "id": 15, "code": "Q", "name": "Rewards and Punishments",        "description": "Deeds rewarded and punished, and the kinds of each." },
    { "id": 16, "code": "R", "name": "Captives and Fugitives",         "description": "Captivity, abduction, escape, pursuit, and rescue." },
    { "id": 17, "code": "S", "name": "Unnatural Cruelty",              "description": "Cruel relatives, murders, mutilations, and abandonment." },
    { "id": 18, "code": "T", "name": "Sex",                            "description": "Love, marriage, courtship, chastity, and birth." },
    { "id": 19, "code": "U", "name": "The Nature of Life",             "description": "Reflective observations on the way of the world; the just and the unjust." },
    { "id": 20, "code": "V", "name": "Religion",                       "description": "Religious services, beliefs, virtues, and the sacred." },
    { "id": 21, "code": "W", "name": "Traits of Character",            "description": "Favorable and unfavorable traits of personality." },
    { "id": 22, "code": "X", "name": "Humor",                          "description": "Jokes, humor of discomfiture, and lies." },
    { "id": 23, "code": "Z", "name": "Miscellaneous Groups of Motifs", "description": "Formulas, symbolism, heroes, and motifs not otherwise classified." }
  ]
}
