{
  "framework": "character_crosswalk",
  "title": "Character Model — Propp Role × Greimas Actant × Archetype",
  "source": "authored synthesis for monomyth (Propp 1928 × Greimas 1966 × Jung/Vogler)",
  "license": "authored synthesis; ship-safe",
  "namespace": "ship",
  "domain": "framework",
  "tier_note": "The cross-cutting character model: each dramatic role is a typical alignment across three orthogonal facets. These are PRIORS, not laws — archetypes float (a Shapeshifter can take the Helper or Opponent actant). A generated character selects one alignment as its spine, then may bend facets for twists.",
  "reference_map": {
    "propp_role_ids": "propp_roles",
    "greimas_actant_ids": "greimas_actants",
    "archetype_ids": "archetypes"
  },
  "count": 8,
  "items": [
    { "id": 1, "name": "Protagonist",   "propp_role_ids": [6], "greimas_actant_ids": [1, 4], "archetype_ids": [1],    "description": "The seeker/victim hero who desires the object and benefits from winning it." },
    { "id": 2, "name": "Antagonist",    "propp_role_ids": [1], "greimas_actant_ids": [6],    "archetype_ids": [6],    "description": "The villain who opposes the subject; embodies the shadow to be defeated or integrated." },
    { "id": 3, "name": "Guide",         "propp_role_ids": [2], "greimas_actant_ids": [5, 3], "archetype_ids": [2],    "description": "The donor who tests the hero and bestows the crucial agent or knowledge." },
    { "id": 4, "name": "Companion",     "propp_role_ids": [3], "greimas_actant_ids": [5],    "archetype_ids": [7, 8], "description": "The helper who accompanies and aids; may carry the trickster's disruptive edge." },
    { "id": 5, "name": "Prize",         "propp_role_ids": [4], "greimas_actant_ids": [2, 4], "archetype_ids": [5],    "description": "The sought-for person/object; often ambiguous in loyalty, hence a shapeshifter." },
    { "id": 6, "name": "Quest-Giver",   "propp_role_ids": [5], "greimas_actant_ids": [3],    "archetype_ids": [4],    "description": "The dispatcher who makes the lack known and sends the hero off — the herald of change." },
    { "id": 7, "name": "Pretender",     "propp_role_ids": [7], "greimas_actant_ids": [6],    "archetype_ids": [6, 8], "description": "The false hero who claims the hero's deeds; a secondary shadow/trickster, later exposed." },
    { "id": 8, "name": "Gatekeeper",    "propp_role_ids": [],  "greimas_actant_ids": [6],    "archetype_ids": [3],    "description": "The threshold guardian — no dedicated Propp role; surfaces as the donor's test or a minor opponent barring passage between worlds." }
  ]
}
