{
  "framework": "polti_situations",
  "title": "Polti — The Thirty-Six Dramatic Situations",
  "source": "Georges Polti, The Thirty-Six Dramatic Situations (English tr. Lucille Ray, 1916)",
  "license": "public domain (1916 translation); descriptions authored/paraphrased for monomyth",
  "namespace": "ship",
  "domain": "framework",
  "tier_note": "Adopted wholesale as a conflict/encounter enum. Each situation names the roles ('dynamic elements') it requires — these map onto encounter templates whose slots the generator fills.",
  "count": 36,
  "items": [
    { "id": 1,  "name": "Supplication",                         "roles": ["Persecutor", "Suppliant", "Power in Authority"], "description": "A suppliant pleads with a power whose decision is uncertain, against a persecutor." },
    { "id": 2,  "name": "Deliverance",                          "roles": ["Unfortunate", "Threatener", "Rescuer"], "description": "An unfortunate is saved from a threatener by an unexpected rescuer." },
    { "id": 3,  "name": "Crime Pursued by Vengeance",           "roles": ["Avenger", "Criminal"], "description": "An avenger pursues and punishes a criminal for a wrong done." },
    { "id": 4,  "name": "Vengeance Taken for Kin upon Kin",     "roles": ["Avenging Kinsman", "Guilty Kinsman", "Victim (relative of both)"], "description": "One relative avenges a wronged relative by striking at a guilty relative." },
    { "id": 5,  "name": "Pursuit",                              "roles": ["Fugitive", "Pursuer"], "description": "A fugitive flees punishment or a relentless pursuer." },
    { "id": 6,  "name": "Disaster",                             "roles": ["Vanquished Power", "Victorious Enemy or Messenger"], "description": "A power is overthrown; catastrophe befalls the once-mighty." },
    { "id": 7,  "name": "Falling Prey to Cruelty or Misfortune","roles": ["Unfortunate", "Master or Misfortune"], "description": "A helpless victim suffers at the hands of a cruel master or blind misfortune." },
    { "id": 8,  "name": "Revolt",                               "roles": ["Tyrant", "Conspirator"], "description": "One or many conspire and rise against an oppressive power." },
    { "id": 9,  "name": "Daring Enterprise",                    "roles": ["Bold Leader", "Object", "Adversary"], "description": "A bold leader undertakes a hazardous venture to seize an object against an adversary." },
    { "id": 10, "name": "Abduction",                            "roles": ["Abductor", "Abducted", "Guardian"], "description": "A person is carried off from a guardian by an abductor." },
    { "id": 11, "name": "The Enigma",                           "roles": ["Interrogator", "Seeker", "Problem"], "description": "A seeker must solve a riddle or problem set by an interrogator, often on pain of death." },
    { "id": 12, "name": "Obtaining",                            "roles": ["Solicitor", "Adversary who Refuses", "Arbitrator"], "description": "Something is won by persuasion or force over one who refuses, sometimes via an arbitrator." },
    { "id": 13, "name": "Enmity of Kin",                        "roles": ["Malevolent Kinsman", "Hated Kinsman"], "description": "Hatred divides those bound by blood." },
    { "id": 14, "name": "Rivalry of Kin",                       "roles": ["Preferred Kinsman", "Rejected Kinsman", "Object"], "description": "Relatives compete for the same object of desire." },
    { "id": 15, "name": "Murderous Adultery",                   "roles": ["Two Adulterers", "Betrayed Spouse"], "description": "Two lovers conspire to kill the betrayed spouse who stands between them." },
    { "id": 16, "name": "Madness",                              "roles": ["Madman", "Victim"], "description": "One driven mad brings harm upon a victim." },
    { "id": 17, "name": "Fatal Imprudence",                     "roles": ["Imprudent", "Victim or Object Lost"], "description": "A careless act by one brings ruin upon themselves or another." },
    { "id": 18, "name": "Involuntary Crimes of Love",           "roles": ["Lover", "Beloved", "Revealer"], "description": "Lovers discover, too late, a forbidden bond (e.g., unknowing incest) they did not intend." },
    { "id": 19, "name": "Slaying of a Kinsman Unrecognized",    "roles": ["Slayer", "Unrecognized Victim"], "description": "One kills a relative without recognizing them, learning the truth after." },
    { "id": 20, "name": "Self-Sacrifice for an Ideal",          "roles": ["Hero", "Ideal", "Person or Thing Sacrificed"], "description": "A hero gives up all — even life — for a cause or belief." },
    { "id": 21, "name": "Self-Sacrifice for Kindred",           "roles": ["Hero", "Kinsman", "Person or Thing Sacrificed"], "description": "A hero sacrifices themselves or their interests for a loved one." },
    { "id": 22, "name": "All Sacrificed for a Passion",         "roles": ["Lover", "Object of Passion", "Person or Thing Sacrificed"], "description": "Everything is thrown away for the sake of an overwhelming passion." },
    { "id": 23, "name": "Necessity of Sacrificing Loved Ones",  "roles": ["Hero", "Beloved Victim", "Necessity"], "description": "Circumstance forces a hero to sacrifice one they love." },
    { "id": 24, "name": "Rivalry of Superior and Inferior",     "roles": ["Superior Rival", "Inferior Rival", "Object"], "description": "An unequal pair — in rank, power, or fortune — compete for the same prize." },
    { "id": 25, "name": "Adultery",                             "roles": ["Deceived Spouse", "Two Adulterers"], "description": "A spouse is betrayed by their partner and a third party." },
    { "id": 26, "name": "Crimes of Love",                       "roles": ["Lover", "Beloved"], "description": "A love that transgresses law or taboo (in kind, age, or bond)." },
    { "id": 27, "name": "Discovery of the Dishonor of a Loved One", "roles": ["Discoverer", "Guilty One"], "description": "One learns that a loved one has committed a shameful act." },
    { "id": 28, "name": "Obstacles to Love",                    "roles": ["Two Lovers", "Obstacle"], "description": "Lovers are kept apart by an obstacle (family, station, circumstance)." },
    { "id": 29, "name": "An Enemy Loved",                       "roles": ["Beloved Enemy", "Lover", "Hater"], "description": "One loves a person who belongs to the enemy side, torn between love and loyalty." },
    { "id": 30, "name": "Ambition",                             "roles": ["Ambitious Person", "Thing Coveted", "Adversary"], "description": "A driving ambition brings one into conflict with those who would restrain it." },
    { "id": 31, "name": "Conflict with a God",                  "roles": ["Mortal", "Immortal"], "description": "A mortal contends against, defies, or is punished by a divine power." },
    { "id": 32, "name": "Mistaken Jealousy",                    "roles": ["Jealous One", "Object of Jealousy", "Supposed Accomplice", "Cause of the Error"], "description": "Jealousy founded on a mistake drives one to ruinous action." },
    { "id": 33, "name": "Erroneous Judgment",                   "roles": ["Mistaken One", "Victim of the Mistake", "Cause of the Error", "Guilty Person"], "description": "A false conclusion condemns the innocent while the guilty go free." },
    { "id": 34, "name": "Remorse",                              "roles": ["Culprit", "Victim or Sin", "Interrogator"], "description": "A culprit is tormented by conscience over a past deed." },
    { "id": 35, "name": "Recovery of a Lost One",               "roles": ["Seeker", "One Found"], "description": "A lost person is sought and at last found again." },
    { "id": 36, "name": "Loss of Loved Ones",                   "roles": ["Kinsman Slain", "Kinsman Spectator", "Executioner"], "description": "One helplessly witnesses or endures the loss of loved ones." }
  ]
}
