{
  "framework": "arc_crosswalk",
  "title": "Arc Binding — Campbell Stage → Propp Functions (macro ↔ meso)",
  "source": "authored synthesis for monomyth (Campbell 1949 × Propp 1928)",
  "license": "authored synthesis; ship-safe",
  "namespace": "ship",
  "domain": "framework",
  "tier_note": "Binds the macro arc to the meso grammar: each Campbell stage maps to the Propp functions that typically realize it. Priors, not laws — a stage may realize via other functions or none. Empty `propp_function_ids` marks a psychological/transitional stage with no direct Propp counterpart. ADR-0022 Phase S1 adds a parallel `propp_function_weights` array (permille, `0..=1000`); all entries are currently `1000` (all-FULL), so weighted selection is behaviorally uniform until real scholarship weights are authored.",
  "reference_map": {
    "campbell_stage_id": "campbell_monomyth",
    "propp_function_ids": "propp_functions",
    "propp_function_weights": "propp_functions (parallel weight, permille)"
  },
  "count": 17,
  "items": [
    { "id": 1,  "name": "Call to Adventure → Villainy/Lack + Mediation",      "campbell_stage_id": 1,  "propp_function_ids": [8, 9],    "propp_function_weights": [1000, 1000], "description": "The disturbance that launches the plot: harm or lack, made known." },
    { "id": 2,  "name": "Refusal of the Call → (no direct function)",         "campbell_stage_id": 2,  "propp_function_ids": [],        "propp_function_weights": [],           "description": "Hesitation preceding the decision to counteract; psychological, not a Propp move." },
    { "id": 3,  "name": "Supernatural Aid → Donor + Receipt of Agent",        "campbell_stage_id": 3,  "propp_function_ids": [12, 14],  "propp_function_weights": [1000, 1000], "description": "The mentor tests and bestows the magical agent." },
    { "id": 4,  "name": "Crossing the First Threshold → Departure",           "campbell_stage_id": 4,  "propp_function_ids": [11, 15],  "propp_function_weights": [1000, 1000], "description": "The hero leaves the known world and is guided toward the object." },
    { "id": 5,  "name": "Belly of the Whale → Guidance",                      "campbell_stage_id": 5,  "propp_function_ids": [15],      "propp_function_weights": [1000],       "description": "Full passage into the unknown; transference to the site of trial." },
    { "id": 6,  "name": "The Road of Trials → Hero's Reaction + Struggle",    "campbell_stage_id": 6,  "propp_function_ids": [13, 16],  "propp_function_weights": [1000, 1000], "description": "Tests and combats the hero must survive and learn from." },
    { "id": 7,  "name": "Meeting with the Goddess → Receipt of Agent",        "campbell_stage_id": 7,  "propp_function_ids": [14],      "propp_function_weights": [1000],       "description": "Encounter with a giving power; the hero gains what is needed." },
    { "id": 8,  "name": "Woman as Temptress → Trickery + Complicity",         "campbell_stage_id": 8,  "propp_function_ids": [6, 7],    "propp_function_weights": [1000, 1000], "description": "Temptation and deception that may divert the hero." },
    { "id": 9,  "name": "Atonement with the Father → Struggle + Branding",    "campbell_stage_id": 9,  "propp_function_ids": [16, 17],  "propp_function_weights": [1000, 1000], "description": "Confrontation with the ultimate authority; the hero is marked." },
    { "id": 10, "name": "Apotheosis → Victory",                               "campbell_stage_id": 10, "propp_function_ids": [18],      "propp_function_weights": [1000],       "description": "The adversary is overcome; the hero transcends former limits." },
    { "id": 11, "name": "The Ultimate Boon → Liquidation",                    "campbell_stage_id": 11, "propp_function_ids": [19],      "propp_function_weights": [1000],       "description": "The goal is achieved; the initial lack is resolved." },
    { "id": 12, "name": "Refusal of the Return → (no direct function)",       "campbell_stage_id": 12, "propp_function_ids": [],        "propp_function_weights": [],           "description": "Reluctance to return; psychological, not a Propp move." },
    { "id": 13, "name": "The Magic Flight → Return + Pursuit",                "campbell_stage_id": 13, "propp_function_ids": [20, 21],  "propp_function_weights": [1000, 1000], "description": "Escape with the boon, sometimes as a chase." },
    { "id": 14, "name": "Rescue from Without → Rescue",                       "campbell_stage_id": 14, "propp_function_ids": [22],      "propp_function_weights": [1000],       "description": "Aides bring the wounded or reluctant hero back." },
    { "id": 15, "name": "Return Threshold → Unrecognized Arrival",           "campbell_stage_id": 15, "propp_function_ids": [23],      "propp_function_weights": [1000],       "description": "Re-entry into the ordinary world, often unrecognized." },
    { "id": 16, "name": "Master of Two Worlds → Recognition + Transfiguration","campbell_stage_id": 16, "propp_function_ids": [27, 29], "propp_function_weights": [1000, 1000], "description": "The hero is recognized and transfigured; balance achieved." },
    { "id": 17, "name": "Freedom to Live → Wedding",                          "campbell_stage_id": 17, "propp_function_ids": [31],      "propp_function_weights": [1000],       "description": "Reward and resolution; the hero is elevated and free." }
  ]
}
